{
  "schema_version": "issue-publisher-proposal.v0",
  "proposal_id": "sample.r8-dai4.lodging-tax.001",
  "proposal_kind": "sample",
  "publication_status": "not_published",
  "note": "This is a proposal sample for Issue Publisher validation. It is not published content.",
  "issue_id": "issue-r8d4-lodging-tax-finance",
  "issue_title": "宿泊税と観光財源・基金の使い方",
  "diet_session_slug": "ishigaki-r8-dai4-teireikai",
  "claim_type": "attributed_speech",
  "proposal_type": "discussion_point",
  "public_draft": {
    "summary_easy": "石垣市宿泊税基金条例と税の活用について、一般質問の答弁では、条例の趣旨や税収の使い道の考え方が説明されました。",
    "summary_detailed": "令和8年第4回定例会の一般質問では、石垣市宿泊税基金条例について、税収を一般財源と区分して管理する考え方や、税収の使途・評価の考え方を宿泊税マスタープランに沿って整理する旨の答弁がありました。これは発言の存在を示す proposal sample であり、制度の効力や将来の運用内容そのものを transcript だけで確定するものではありません."
  },
  "evidence": [
    {
      "source_type": "general_question_minutes",
      "anchor": "ishigaki-r8-dai4-teireikai.gq.ishigaki-r8-dai4-ippan-irabu-kazuma.u0008",
      "evidence_role": "primary",
      "mode": "paraphrase",
      "note": "Transcript evidence supports that an explanation about the ordinance purpose, transparent tax handling, and the intended use framework was given in response."
    },
    {
      "source_type": "general_question_minutes",
      "anchor": "ishigaki-r8-dai4-teireikai.gq.ishigaki-r8-dai4-ippan-irabu-kazuma.u0031",
      "evidence_role": "secondary",
      "mode": "paraphrase",
      "note": "Transcript evidence supports that an explanation about the master plan positioning and how the use framework would be organized was given in response."
    }
  ],
  "links": {
    "related_bill_ids": [],
    "related_question_slugs": [
      "ishigaki-r8-dai4-ippan-irabu-kazuma"
    ]
  },
  "review": {
    "status": "pending",
    "needs_human_review": true,
    "review_reason": [
      "sample_proposal",
      "transcript_derived",
      "attributed_speech_only"
    ]
  }
}
